{
  "contract_id": "audit-quality-candidates",
  "contract_version": "1.0.0",
  "ledger_sha256": "a1b2c3d4e5f67890a1b2c3d4e5f67890a1b2c3d4e5f67890a1b2c3d4e5f67890",
  "schema_mapping_version": "1.0.0",
  "period": "2026-01",
  "rule_pack_sha256": "1111111111111111111111111111111111111111111111111111111111111111",
  "rules": ["duplicate_row", "large_amount", "missing_or_invalid_amount", "out_of_period", "unbalanced_entry"],
  "summary": {
    "total_rows": 4,
    "candidate_count": 2,
    "duplicate_rows": 1,
    "unbalanced_entries": 0,
    "out_of_period_rows": 0,
    "truncated": false
  },
  "candidates": [
    {
      "rule_id": "duplicate_row:2",
      "rule_key": "duplicate_row",
      "severity": "medium",
      "row_ref": "2",
      "source_ref": "ledger:a1b2c3d4:row:2",
      "reason_code": "DUPLICATE_ROW",
      "score": 0.8,
      "evidence": {
        "source_sha256": "a1b2c3d4e5f67890a1b2c3d4e5f67890a1b2c3d4e5f67890a1b2c3d4e5f67890",
        "row_fingerprint": "f0e0d0c0b0a090807060504030201000",
        "fields": {"entry_id": "V-2026-0001", "amount_note": "identical to row 1"}
      }
    },
    {
      "rule_id": "large_amount:3",
      "rule_key": "large_amount",
      "severity": "low",
      "row_ref": "3",
      "source_ref": "ledger:a1b2c3d4:row:3",
      "reason_code": "LARGE_AMOUNT",
      "score": 0.6,
      "evidence": {
        "source_sha256": "a1b2c3d4e5f67890a1b2c3d4e5f67890a1b2c3d4e5f67890a1b2c3d4e5f67890",
        "debit_amount": "2000000.00",
        "credit_amount": "0.00",
        "threshold": 1000000
      }
    }
  ]
}